video_id,title,channel_title,channel_id,view_count,like_count,comment_count,published_at,duration,thumbnail_url,video_url,tags,engagement_rate,performance_score,influencer_subscriber_count,description_snippet
FLoUEzG4ByU,Build a Website using ChatGPT in 1 Minute  #openai #chatgpt,ChatGPT Tutorials,UCnfaBjtUeuVoUrTuBBGH40g,867509,15171,300,2023-01-02T07:07:49Z,PT3M,https://i.ytimg.com/vi/FLoUEzG4ByU/maxresdefault.jpg,https://www.youtube.com/watch?v=FLoUEzG4ByU,chatgpt how to use;chatgpt examples;chatgpt api;openai chatbot gpt;chatgpt programming;chatGPT;ai chatbot;what is open ai;playground openai;chat openai;coding with chatgpt;chatgpt tutorial;how to use chatgpt;chat gpt to make money;chat gpt api;chatgpt coding;chat gpt website;chatgpt clone;build a website using chatgpt;chatgpt website design;how to create a website using chatgpt;create website using chat gpt;how to make website using chatgpt;#chatgpt,1.82,7833.58,111000,"#openai #chatgpt 

In this video, we will build a full stack web app using chat gpt. 
We are gonna build a random emoji generator website.
Every time you visit this website ,it will show you a differe..."
K09xQuFdDuA,Earn Money by Building and Selling APIs with ChatGPT  #openai #chatgpt $100 per month,ChatGPT Tutorials,UCnfaBjtUeuVoUrTuBBGH40g,403483,9323,282,2023-01-08T10:45:40Z,PT4M29S,https://i.ytimg.com/vi/K09xQuFdDuA/maxresdefault.jpg,https://www.youtube.com/watch?v=K09xQuFdDuA,make money with chatgpt;make money with chatbots;make money with chat gpt for free;make money with chatgpt on youtube;build and sell api;build and sell api python;api monetization;api monetization ideas;api monetization examples;how to make money with chatgpt;chat gpt to make money;chat gpt to make money online;chat gpt to make money trading;ways to make money with chatgpt;how to use chatgpt to earn money;chatgpt tutorial;python;gpt 3;amazon ai,2.45,3659.49,111000,"#openai #chatgpt #makemoneyonline 
In this video, I will show you how to make money online with chat gpt.
We will build an API using chat gpt and then sell it on rapidapi.
In case you didn’t know, rap..."
Y4QYVoi2WOQ,Shelly Wall Display vs Sonoff NS Panel Pro for Home Assistant Dashboards,Home Automation Guy,UC67SMH0qLMJ4b4Guud0mKjw,253120,4955,413,2024-10-26T08:00:20Z,PT11M33S,https://i.ytimg.com/vi/Y4QYVoi2WOQ/maxresdefault.jpg,https://www.youtube.com/watch?v=Y4QYVoi2WOQ,,2.28,2438.16,106000,"It's surprisingly easy to display Home Assistant dashboards on the Shelly Wall Display and NS Panel Pro, but which one is best?

❤️ Found this video useful and want to support the channel? I'd love a ..."
etTE-mjLiTw,Build AI Chat Bot using ChatGPT API 👉  gpt-3.5-turbo 👈 #chatgpt #openai,ChatGPT Tutorials,UCnfaBjtUeuVoUrTuBBGH40g,151236,2074,134,2023-03-19T11:36:16Z,PT4M22S,https://i.ytimg.com/vi/etTE-mjLiTw/maxresdefault.jpg,https://www.youtube.com/watch?v=etTE-mjLiTw,chat gpt clone;chat gpt clone python;create chat gpt clone;build chat gpt clone;chat gpt clone github;chat gpt clone project;chat gpt api tutorial;chat gpt api python;prompt engineering;flask tutorial;what is api;openai api;openai api projects;openai api chatbot;chat gpt prompts;chatgpt api;chatgpt coding;chatgpt python;chatgpt prompts;chatgpt programming;openai codex;chat gpt explained;chat gpt;gpt-3.5-turbo;chat gpt api;gpt api,1.55,1377.97,111000,"#openai #chatgpt #gpt4 

In this video, we'll show you how to build a chatbot using the OpenAI's Chat GPT API and Flask. We'll walk you through step by step, from setting up your Flask app to integrat..."
sXamQXKgSeU,27 FREE Things You Can Do With Gemini,Matt Wolfe,UChpleBmo18P08aKCIgti38g,336480,13291,617,2025-07-02T13:01:53Z,PT27M52S,https://i.ytimg.com/vi/sXamQXKgSeU/maxresdefault.jpg,https://www.youtube.com/watch?v=sXamQXKgSeU,AI;Artificial Intelligence;FutureTools;Futurism;Machine Learning;Deep Learning;Future Tools;Matt Wolfe;AI News;AI Tools;google;gemini;free ai tools;tutorial;chatgpt;perplexity;claude;anthropic,4.32,567.42,785000,"I've been using Google Gemini a ton lately, and that's because of all the incredible stuff you can do with it for FREE!! In this video I'll walk you through the coolest tools and prompts I'm using.

D..."
aVnlZKV-ZJQ,"GPT-5, Actually Useful Video Tools, and AI Avatars generate $7 million",Matt Wolfe,UChpleBmo18P08aKCIgti38g,109409,3693,281,2025-06-21T13:00:03Z,PT24M29S,https://i.ytimg.com/vi/aVnlZKV-ZJQ/maxresdefault.jpg,https://www.youtube.com/watch?v=aVnlZKV-ZJQ,AI;Artificial Intelligence;FutureTools;Futurism;Machine Learning;Deep Learning;Future Tools;Matt Wolfe;AI News;AI Tools;openai;chatgpt;google;microsoft;midjourney,3.89,270.87,785000,"Here's everything you missed this week in the world of AI!
Learn more about LTX Studio here: https://tinyurl.com/2dbcgbzu

Discover More:
🛠️ Explore AI Tools & News: https://futuretools.io/
📰 Weekly N..."
TYEqenKrbaM,Right Way To Learn AI In 2025,Krish Naik,UCNU_lfiiWBdtULKOw6X0Dig,161981,4891,192,2025-06-10T14:51:04Z,PT20M29S,https://i.ytimg.com/vi/TYEqenKrbaM/maxresdefault.jpg,https://www.youtube.com/watch?v=TYEqenKrbaM,yt:cc=on;roadmap to learn AI;generative ai tutorials;mcp tutroials;agentic ai tutorials;ai agents tutorials,3.26,253.85,1230000,"AI is not a jargon anymore. It is the technology that will derive everything.In this video we will discuss about the entire roadmap how we should approach learning learning AI.
If you want to learn fr..."
